### ISSUE TITLE
No response is received in case of an erroneous http2 request

### ISSUE THREAD

**Issue by EvgeniiMekhanik** [tempesta-tech/tempesta#1794]
# Scope

In case when tempesta can't parse request or request is forbidden, we should send response to the client if `block_action attack` or `block_action error` is set to `reply`. 

# Testing
Test to reproduce sessions/test_h2_sticky_scheduler.py

**Comment by EvgeniiMekhanik** [comment]
I captured network traffic for two cases:

-- Test passed
23:59:18.264853 IP localhost.8765 > localhost.43066: Flags [P.], seq 1067:1167, ack 862, win 512, options [nop,nop,TS val 1593850684 ecr 1593850670], length 100
23:59:18.264860 IP localhost.8765 > localhost.43066: Flags [P.], seq 1167:1213, ack 862, win 512, options [nop,nop,TS val 1593850686 ecr 1593850670], length 46
23:59:18.264862 IP localhost.8765 > localhost.43066: Flags [P.], seq 1213:1244, ack 900, win 512, options [nop,nop,TS val 1593850689 ecr 1593850682], length 31
23:59:18.264863 IP localhost.8765 > localhost.43066: Flags [R.], seq 1244, ack 900, win 512, options [nop,nop,TS val 1593850689 ecr 1593850682], length 0
23:59:18.264865 IP localhost.43066 > localhost.8765: Flags [.], ack 1167, win 512, options [nop,nop,TS val 1593850690 ecr 1593850684], length 0
23:59:18.264874 IP localhost.43066 > localhost.8765: Flags [.], ack 1213, win 512, options [nop,nop,TS val 1593850690 ecr 1593850686], length 0
23:59:18.264875 IP localhost.43066 > localhost.8765: Flags [.], ack 1244, win 512, options [nop,nop,TS val 1593850690 ecr 1593850689], length 0


-- Test failed
00:06:51.850563 IP localhost.8765 > localhost.43608: Flags [P.], seq 1068:1168, ack 862, win 512, options [nop,nop,TS val 1594304275 ecr 1594304275], length 100
00:06:51.850564 IP localhost.8765 > localhost.43608: Flags [P.], seq 1168:1214, ack 862, win 512, options [nop,nop,TS val 1594304275 ecr 1594304275], length 46
00:06:51.850564 IP localhost.8765 > localhost.43608: Flags [P.], seq 1214:1245, ack 862, win 512, options [nop,nop,TS val 1594304275 ecr 1594304275], length 31
00:06:51.850565 IP localhost.8765 > localhost.43608: Flags [R.], seq 1245, ack 862, win 512, options [nop,nop,TS val 1594304275 ecr 1594304275], length 0
00:06:51.850569 IP localhost.43608 > localhost.8765: Flags [.], ack 1245, win 511, options [nop,nop,TS val 1594304275 ecr 1594304275], length 0

As i see in case when test passed client sent ACK for each previously received packets with data. In case when test failed client send ACK only for RST. As i read in RFC793 if client receive RST he immediately drop TCB and all buffers with previously received data. Thus, even if we send RST in the correct order, we cannot guarantee that the data sent earlier will be accepted by the client.

**Comment by EvgeniiMekhanik** [comment]
So i think that we should not send active reset in case when we send reply to client!

**Comment by krizhanovsky** [comment]
Yes, agree. And this is perfectly aligned with the behavior (RST vs response) in https://github.com/tempesta-tech/tempesta/wiki/Handling-clients#error-responses
