### ISSUE TITLE
cannot find appropriate virtual host

### ISSUE THREAD

**Issue by krizhanovsky** [tempesta-tech/tempesta#1074]
I get `Warning: request dropped: cannot find appropriate virtual host, status 404` for the configuration at the below:
```
listen 80;
server 127.0.0.1:8080;
cache 1;
cache_fulfill * *;
sticky enforce;
js_challenge resp_code=503 delay_min=1000 delay_range=1000 delay_limit=3000 /root/master/etc/js_challenge.html;
```
Apache HTTPD with tempesta-tech.com is running in the same VM on 8080. The traffic is (I use Chrome for the request):
```
20:28:44.834334 IP 192.168.100.1.40380 > 192.168.100.4.80: Flags [P.], seq 917067469:917067944, ack 621472777, win 229, options [nop,nop,TS val 1259675188 ecr 3762659891], length 475: HTTP: GET / HTTP/1.1
E.....@.@.l...d...d....P6.V.%
.	...........
K..4.E.3GET / HTTP/1.1
Host: debian
Connection: keep-alive
Cache-Control: max-age=0
User-Agent: Mozilla/5.0 (X11; Linux x86_64) AppleWebKit/537.36 (KHTML, like Gecko) Chrome/63.0.3239.132 Safari/537.36
Upgrade-Insecure-Requests: 1
Accept: text/html,application/xhtml+xml,application/xml;q=0.9,image/webp,image/apng,*/*;q=0.8
Accept-Encoding: gzip, deflate
Accept-Language: en-US,en;q=0.9,ru;q=0.8
Cookie: _ga=GA1.1.1129566486.1538759973; _gid=GA1.1.1088249423.1538759973


20:28:44.843466 IP 192.168.100.4.80 > 192.168.100.1.40380: Flags [.], ack 917067944, win 235, options [nop,nop,TS val 3762659903 ecr 1259675188], length 0
E..4..@.@.8...d...d..P..%
.	6.X......;.....
.E.?K..4
20:28:44.843737 IP 192.168.100.4.80 > 192.168.100.1.40380: Flags [P.], seq 621472777:621472910, ack 917067944, win 235, options [nop,nop,TS val 3762659904 ecr 1259675188], length 133: HTTP: HTTP/1.1 404 Not Found
E.....@.@.8...d...d..P..%
.	6.X............
.E.@K..4HTTP/1.1 404 Not Found
Date: Fri, 05 Oct 2018 17:28:44 GMT
Content-Length: 0
Server: Tempesta FW/0.6.0
Connection: keep-alive
```

Why the warning is produced? I'd expect that in this configuration a default vhost is generated.

**Comment by krizhanovsky** [comment]
It seems the problem is that JS and cookie challenge can not be per-vhost, so please make them per-vhost'able.

Also, guys we have to specify for each configuration option whether it can be per-vhost or not (Nginx does this with context). Please update this whenever you touch the Wiki for some config option.

**Comment by krizhanovsky** [comment]
I tried following configuration:
```
listen 80;
srv_group default {
	server 127.0.0.1:8080;
}
vhost default {
	proxy_pass default;
}

cache 1;
cache_fulfill * *;

sticky enforce;
js_challenge resp_code=503 delay_min=1000 delay_range=1000 delay_limit=3000 /root/master/etc/js_challenge.html;

http_chain {
	-> default;
}
```
Tempesta FW responds with 503 and Set-Cookie, Chrome resends a request with the cookie, but Tempesta is unable to process it correctly and replies with 503 again:
```
22:01:42.192827 IP 192.168.100.1.44252 > 192.168.100.4.80: Flags [P.], seq 880135830:880136335, ack 3771862946, win 229, options [nop,nop,TS val 1273874937 ecr 2328812456], length 505: HTTP: GET / HTTP/1.1
E..-Gt@.@.....d...d....P4u..........
......
K.......GET / HTTP/1.1
Host: debian
Connection: keep-alive
Cache-Control: max-age=0
User-Agent: Mozilla/5.0 (X11; Linux x86_64) AppleWebKit/537.36 (KHTML, like Gecko) Chrome/63.0.3239.132 Safari/537.36
Upgrade-Insecure-Requests: 1
Accept: text/html,application/xhtml+xml,application/xml;q=0.9,image/webp,image/apng,*/*;q=0.8
Accept-Encoding: gzip, deflate
Accept-Language: en-US,en;q=0.9,ru;q=0.8
Cookie: _ga=GA1.1.1129566486.1538759973; __tfw=00000000ffffc7612566657f5a9e425ebd8022fba84f85e99c725839


22:01:42.195741 IP 192.168.100.4.80 > 192.168.100.1.44252: Flags [.], ack 880136335, win 235, options [nop,nop,TS val 2328812471 ecr 1273874937], length 0
E..4.n@.@.[...d...d..P......4u.......h.....
....K...
22:01:42.196083 IP 192.168.100.4.80 > 192.168.100.1.44252: Flags [P.], seq 3771862946:3771863937, ack 880136335, win 235, options [nop,nop,TS val 2328812471 ecr 1273874937], length 991: HTTP: HTTP/1.1 503 Service Unavailable
E....o@.@.X...d...d..P......4u.............
....K...HTTP/1.1 503 Service Unavailable
Date: Sat, 06 Oct 2018 19:01:42 GMT
Location: http://debian/
Set-Cookie: __tfw=00000000ffffc761d2012b5825bbe50068c216cfaceddd3454d2d489
Connection: keep-alive
Content-Length: 771

<html>
    <body>
        <p></p>&nbsp;<p></p>
        <h2 align='center'>
            <a href="http://tempesta-tech.com">Tempesta FW</a>
            is verifying your browser, please wait a little bit...
        </h2>
        <p></p>&nbsp;<p></p>

        <script>var prefix = "__tfw";
var delay_min = 1000;
var delay_range = 1000;
if (navigator.cookieEnabled
    && document.cookie.startsWith(prefix))
{
    var ts = "0x" + document.cookie.substr(prefix.length + 1, 16);
    setTimeout(function() {
        location.reload();
    }, delay_min + Number(ts) % delay_range);
} else {
    document.write("<h3 align='center' style='color:red'>"
                   + "Please enable cookies and reload"
                   + " the page</h3>");
}
</script>
    </body>
</html>
.
22:01:42.196109 IP 192.168.100.1.44252 > 192.168.100.4.80: Flags [.], ack 3771863937, win 251, options [nop,nop,TS val 1273874940 ecr 2328812471], length 0
E..4Gu@.@.....d...d....P4u..........	v.....
K.......
22:01:42.658511 IP 192.168.100.1.44252 > 192.168.100.4.80: Flags [P.], seq 880136335:880136774, ack 3771863937, win 251, options [nop,nop,TS val 1273875403 ecr 2328812471], length 439: HTTP: GET /favicon.ico HTTP/1.1
E...Gv@.@..@..d...d....P4u.................
K.......GET /favicon.ico HTTP/1.1
Host: debian
Connection: keep-alive
User-Agent: Mozilla/5.0 (X11; Linux x86_64) AppleWebKit/537.36 (KHTML, like Gecko) Chrome/63.0.3239.132 Safari/537.36
Accept: image/webp,image/apng,image/*,*/*;q=0.8
Referer: http://debian/
Accept-Encoding: gzip, deflate
Accept-Language: en-US,en;q=0.9,ru;q=0.8
Cookie: _ga=GA1.1.1129566486.1538759973; __tfw=00000000ffffc761d2012b5825bbe50068c216cfaceddd3454d2d489


22:01:42.661474 IP 192.168.100.4.80 > 192.168.100.1.44252: Flags [F.], seq 3771863937:3771864097, ack 880136774, win 243, options [nop,nop,TS val 2328812936 ecr 1273875403], length 160: HTTP: HTTP/1.1 503 Service Unavailable
E....p@.@.[]..d...d..P......4u.F....pJ.....
....K...HTTP/1.1 503 Service Unavailable
Date: Sat, 06 Oct 2018 19:01:42 GMT
Content-Length: 0
Retry-After: 10
Server: Tempesta FW/0.6.0
Connection: keep-alive
```

So JS challenge is broken.

Please also update Wiki with real life example to configure a JS challenge, a full config like the above is required to allow users easily get an idea how make a valid full configuration.

**Comment by ikoveshnikov** [comment]
> Tempesta FW responds with 503 and Set-Cookie, Chrome resends a request with the cookie, but Tempesta is unable to process it correctly and replies with 503 again

Situation is little bit different here. Look to the GET requests: first is `GET / HTTP/1.1`, while second is `GET /favicon.ico HTTP/1.1`. `/` is challengeable resource: client sends `Accept: text/html` telling that the browser will try to run JS code in response payload. `/favicon.ico` can't be challenged and Tempesta closes the connection with 503 error. 

When I try it on my own, Chrome opens a new connection after that and successfully passes the JS challenge, and can access the protected site. Was there something alike?

**Comment by ikoveshnikov** [comment]
The original issue mentioned two problems which were closed in cb1a6d299ed77a1afeeb2072383fdd9a148a105c and 71b947206ffa1debb0af8d58115d2c135a5341dd

**Comment by krizhanovsky** [comment]
I still see the issue on current master (as of 9d1a39311f678f8dd197438c47a27f9346720965). The same Chrome running on the host system is used to access Apache HTTPD running on 8080 port on a VM through Tempesta FW running on port 80 with the following config:
```
root@debian:~/1074/tempesta# cat etc/tempesta_fw.conf
listen 80;
srv_group default {
	server 127.0.0.1:8080;
}
vhost default {
	proxy_pass default;
}

cache 1;
cache_fulfill * *;

sticky enforce;
js_challenge resp_code=503 delay_min=1000 delay_range=1000 delay_limit=3000 /root/1074/tempesta/etc/js_challenge.html;

http_chain {
	-> default;
}
```

In the browser I see the redirection message and after the timeout it shows `debian is currently unable to handle this request. HTTP ERROR 503` (`debian` is the name of my VM).

dmesg:
```
root@debian:~/1074/tempesta# dmesg|grep tempesta
[   34.976557] tempesta_lib: loading out-of-tree module taints kernel.
[   35.020373] [tempesta] Initializing Tempesta FW kernel module...
[   35.021066] [tempesta] Registering new classifier: frang
[   35.023649] [tempesta] Registering new scheduler: hash
[   35.024139] [tempesta] Registering new scheduler: ratio
[   35.146321] [tempesta] Prepearing for the configuration processing.
[   35.147030] [tempesta] Configuration processing is completed.
[   35.161558] [tdb] Opened table /opt/tempesta/db/filter.tdb: size=16777216 rec_size=20 base=ffff9b14bc400000
[   35.314455] [tdb] Opened table /opt/tempesta/db/cache.tdb: size=268435456 rec_size=0 base=ffff9b14ac400000
[   35.315330] [tempesta] Open listen socket on: 0.0.0.0
[   35.331670] [tempesta] modules are started
[   53.560516] [tempesta] Warning: http_sess: bad received HMAC value for 192.168.100.1: a(pos=0), ts=0x1005fd910 orig_hmac=[475af45fa6e89e65ad38c9d665e483516021b971]
[   54.072578] [tempesta] Warning: request dropped: can't send JS challenge., status 503: 192.168.100.1
[   55.706440] [tempesta] Warning: request dropped: invalid sticky cookie or js challenge: 192.168.100.1
```

The full tcpdump log:
```
# tcpdump -nn -i tap0 -A -S -s0 tcp port 80
tcpdump: verbose output suppressed, use -v or -vv for full protocol decode
listening on tap0, link-type EN10MB (Ethernet), capture size 262144 bytes
18:23:11.406519 IP 192.168.100.1.43202 > 192.168.100.4.80: Flags [.], ack 2226675613, win 229, options [nop,nop,TS val 745888765 ecr 2145936925], length 0
E..4.6@.@.c7..d...d....PO....._......'.....
,u[...f.
18:23:11.406538 IP 192.168.100.1.43204 > 192.168.100.4.80: Flags [.], ack 2186913094, win 229, options [nop,nop,TS val 745888765 ecr 2145936929], length 0
E..4U.@.@..z..d...d....P)..9.Y.F...........
,u[...f!
18:23:11.406562 IP 192.168.100.1.43206 > 192.168.100.4.80: Flags [.], ack 4271419999, win 229, options [nop,nop,TS val 745888765 ecr 2145936929], length 0
E..4..@.@.a...d...d....PN..B..._...........
,u[...f!
18:23:11.407640 IP 192.168.100.4.80 > 192.168.100.1.43206: Flags [R], seq 4271419999, win 0, length 0
E..(bs@.@.....d...d..P....._....P....{........
18:23:11.408027 IP 192.168.100.4.80 > 192.168.100.1.43202: Flags [R], seq 2226675613, win 0, length 0
E..(bt@.@.....d...d..P...._.....P....!........
18:23:11.408072 IP 192.168.100.4.80 > 192.168.100.1.43204: Flags [R], seq 2186913094, win 0, length 0
E..(bu@.@.....d...d..P...Y.F....P.............



18:23:25.386263 IP 192.168.100.1.43232 > 192.168.100.4.80: Flags [S], seq 1063919284, win 29200, options [mss 1460,sackOK,TS val 745902744 ecr 0,nop,wscale 7], length 0
E..<(/@.@..6..d...d....P?j........r..<.........
,u..........
18:23:25.386441 IP 192.168.100.1.43234 > 192.168.100.4.80: Flags [S], seq 354965488, win 29200, options [mss 1460,sackOK,TS val 745902745 ecr 0,nop,wscale 7], length 0
E..<al@.@.....d...d....P.(W.......r..?.........
,u..........
18:23:25.386492 IP 192.168.100.1.43236 > 192.168.100.4.80: Flags [S], seq 4263927817, win 29200, options [mss 1460,sackOK,TS val 745902745 ecr 0,nop,wscale 7], length 0
E..<V.@.@.....d...d....P.&`	......r..%.........
,u..........
18:23:25.386505 IP 192.168.100.4.80 > 192.168.100.1.43232: Flags [S.], seq 3598811881, ack 1063919285, win 28960, options [mss 1460,sackOK,TS val 1432016912 ecr 745902744,nop,wscale 7], length 0
E..<..@.@..e..d...d..P......?j....q @E.........
UZ..,u......
18:23:25.386537 IP 192.168.100.1.43232 > 192.168.100.4.80: Flags [.], ack 3598811882, win 229, options [nop,nop,TS val 745902745 ecr 1432016912], length 0
E..4(0@.@..=..d...d....P?j...........K.....
,u..UZ..
18:23:25.386816 IP 192.168.100.4.80 > 192.168.100.1.43236: Flags [S.], seq 3235279098, ack 4263927818, win 28960, options [mss 1460,sackOK,TS val 1432016912 ecr 745902745,nop,wscale 7], length 0
E..<..@.@..e..d...d..P....p..&`
..q g..........
UZ..,u......
18:23:25.386845 IP 192.168.100.1.43236 > 192.168.100.4.80: Flags [.], ack 3235279099, win 229, options [nop,nop,TS val 745902745 ecr 1432016912], length 0
E..4V.@.@.....d...d....P.&`
..p............
,u..UZ..
18:23:25.386915 IP 192.168.100.4.80 > 192.168.100.1.43234: Flags [S.], seq 3056105444, ack 354965489, win 28960, options [mss 1460,sackOK,TS val 1432016912 ecr 745902745,nop,wscale 7], length 0
E..<..@.@..e..d...d..P...(w..(W...q \..........
UZ..,u......
18:23:25.386938 IP 192.168.100.1.43234 > 192.168.100.4.80: Flags [.], ack 3056105445, win 229, options [nop,nop,TS val 745902745 ecr 1432016912], length 0
E..4am@.@.....d...d....P.(W..(w............
,u..UZ..
18:23:25.391589 IP 192.168.100.1.43232 > 192.168.100.4.80: Flags [P.], seq 1063919285:1063919764, ack 3598811882, win 229, options [nop,nop,TS val 745902750 ecr 1432016912], length 479: HTTP: GET / HTTP/1.1
E...(1@.@..]..d...d....P?j..........d......
,u..UZ..GET / HTTP/1.1
Host: debian
Connection: keep-alive
User-Agent: Mozilla/5.0 (X11; Linux x86_64) AppleWebKit/537.36 (KHTML, like Gecko) Chrome/63.0.3239.132 Safari/537.36
Upgrade-Insecure-Requests: 1
Accept: text/html,application/xhtml+xml,application/xml;q=0.9,image/webp,image/apng,*/*;q=0.8
Accept-Encoding: gzip, deflate
Accept-Language: en-US,en;q=0.9,ru;q=0.8
Cookie: _ga=GA1.1.1129566486.1538759973; __tfw=00000001005fd910adb5ca03a8097524abe82ca837a523dddfa6f850


18:23:25.394177 IP 192.168.100.4.80 > 192.168.100.1.43232: Flags [.], ack 1063919764, win 235, options [nop,nop,TS val 1432016919 ecr 745902750], length 0
E..4..@.@.c...d...d..P......?j ......Z.....
UZ..,u..
18:23:25.394302 IP 192.168.100.4.80 > 192.168.100.1.43232: Flags [P.], seq 3598811882:3598813055, ack 1063919764, win 235, options [nop,nop,TS val 1432016919 ecr 745902750], length 1173: HTTP: HTTP/1.1 503 Service Unavailable
E.....@.@._-..d...d..P......?j ............
UZ..,u..HTTP/1.1 503 Service Unavailable
Date: Tue, 30 Oct 2018 15:23:25 GMT
Location: http://debian/
Set-Cookie: __tfw=00000001005fd910475af45fa6e89e65ad38c9d665e483516021b971
Connection: keep-alive
Content-Length: 953

<html>
    <body>
        <p></p>&nbsp;<p></p>
        <h2 align='center'>
            <a href="http://tempesta-tech.com">Tempesta FW</a>
            is verifying your browser, please wait a little bit...
        </h2>
        <p></p>&nbsp;<p></p>

        <script>var c_name = "__tfw";
var delay_min = 1000;
var delay_range = 1000;

function cookieVal(input, c_name) {
    var re = new RegExp("(.*;)?\s*" + c_name + "=([0-9a-f]+)")
    var found = input.match(re)
    if (!found)
        return ""
    return  found[2];
}

var c_val = cookieVal(document.cookie, c_name)

if (navigator.cookieEnabled && !!c_val) {
    var ts = "0x" + c_val.substr(0, 16);
    setTimeout(function() {
        location.reload();
    }, delay_min + Number(ts) % delay_range);
} else {
    document.write("<h3 align='center' style='color:red'>"
                   + "Please enable cookies and reload"
                   + " the page</h3>");
}
</script>
    </body>
</html>
.
18:23:25.394323 IP 192.168.100.1.43232 > 192.168.100.4.80: Flags [.], ack 3598813055, win 251, options [nop,nop,TS val 745902753 ecr 1432016919], length 0
E..4(2@.@..;..d...d....P?j ................
,u..UZ..
18:23:25.903716 IP 192.168.100.1.43232 > 192.168.100.4.80: Flags [P.], seq 1063919764:1063920203, ack 3598813055, win 251, options [nop,nop,TS val 745903262 ecr 1432016919], length 439: HTTP: GET /favicon.ico HTTP/1.1
E...(3@.@.....d...d....P?j .........U......
,u..UZ..GET /favicon.ico HTTP/1.1
Host: debian
Connection: keep-alive
User-Agent: Mozilla/5.0 (X11; Linux x86_64) AppleWebKit/537.36 (KHTML, like Gecko) Chrome/63.0.3239.132 Safari/537.36
Accept: image/webp,image/apng,image/*,*/*;q=0.8
Referer: http://debian/
Accept-Encoding: gzip, deflate
Accept-Language: en-US,en;q=0.9,ru;q=0.8
Cookie: _ga=GA1.1.1129566486.1538759973; __tfw=00000001005fd910475af45fa6e89e65ad38c9d665e483516021b971


18:23:25.904866 IP 192.168.100.4.80 > 192.168.100.1.43232: Flags [P.], seq 3598813055:3598813215, ack 1063920203, win 243, options [nop,nop,TS val 1432017430 ecr 745903262], length 160: HTTP: HTTP/1.1 503 Service Unavailable
E.....@.@.c!..d...d..P......?j"K....R......
UZ..,u..HTTP/1.1 503 Service Unavailable
Date: Tue, 30 Oct 2018 15:23:25 GMT
Content-Length: 0
Retry-After: 10
Server: Tempesta FW/0.6.0
Connection: keep-alive


18:23:25.904909 IP 192.168.100.1.43232 > 192.168.100.4.80: Flags [.], ack 3598813215, win 270, options [nop,nop,TS val 745903263 ecr 1432017430], length 0
E..4(4@.@..9..d...d....P?j"K.........K.....
,u..UZ..
18:23:27.537520 IP 192.168.100.1.43232 > 192.168.100.4.80: Flags [P.], seq 1063920203:1063920733, ack 3598813215, win 270, options [nop,nop,TS val 745904896 ecr 1432017430], length 530: HTTP: GET / HTTP/1.1
E..F(5@.@..&..d...d....P?j"K........cY.....
,u..UZ..GET / HTTP/1.1
Host: debian
Connection: keep-alive
Cache-Control: max-age=0
Upgrade-Insecure-Requests: 1
User-Agent: Mozilla/5.0 (X11; Linux x86_64) AppleWebKit/537.36 (KHTML, like Gecko) Chrome/63.0.3239.132 Safari/537.36
Accept: text/html,application/xhtml+xml,application/xml;q=0.9,image/webp,image/apng,*/*;q=0.8
Referer: http://debian/
Accept-Encoding: gzip, deflate
Accept-Language: en-US,en;q=0.9,ru;q=0.8
Cookie: _ga=GA1.1.1129566486.1538759973; __tfw=00000001005fd910475af45fa6e89e65ad38c9d665e483516021b971


18:23:27.539540 IP 192.168.100.4.80 > 192.168.100.1.43232: Flags [F.], seq 3598813215:3598813375, ack 1063920733, win 252, options [nop,nop,TS val 1432019065 ecr 745904896], length 160: HTTP: HTTP/1.1 503 Service Unavailable
E.....@.@.c ..d...d..P......?j$]....@......
UZ.y,u..HTTP/1.1 503 Service Unavailable
Date: Tue, 30 Oct 2018 15:23:27 GMT
Content-Length: 0
Retry-After: 10
Server: Tempesta FW/0.6.0
Connection: keep-alive


18:23:27.542221 IP 192.168.100.1.43232 > 192.168.100.4.80: Flags [F.], seq 1063920733, ack 3598813376, win 288, options [nop,nop,TS val 745904900 ecr 1432019065], length 0
E..4(6@.@..7..d...d....P?j$]....... .......
,u..UZ.y
18:23:27.542632 IP 192.168.100.4.80 > 192.168.100.1.43232: Flags [.], ack 1063920734, win 252, options [nop,nop,TS val 1432019068 ecr 745904900], length 0
E..4..@.@.c...d...d..P......?j$^...........
UZ.|,u..
^C
26 packets captured
26 packets received by filter
0 packets dropped by kernel
```

**Comment by krizhanovsky** [comment]
I can not reproduce the issue any more after my Chrome updated.

**Comment by krizhanovsky** [comment]
After some tries I got following warnings in dmesg and not fully loaded tempesta-tech.com page:
```
[  154.268941] [tempesta] modules are started
[  160.991619] [tempesta] Warning: request dropped: can't send JS challenge., status 503: 192.168.100.1
[  310.642860] [tempesta] Warning: request dropped: can't send JS challenge., status 503: 192.168.100.1
```
